{
  "$schema": "./provenance.schema.json",
  "status": "reference-inventory-only",
  "distributionReadiness": false,
  "notes": [
    "This register records reusable implementation references and revisions for traceability.",
    "Reference code may be copied or adapted when it fits Jet Black; substantial adaptations record the source files."
  ],
  "references": [
    {
      "name": "Aperant",
      "repository": "https://github.com/AndyMik90/Aperant.git",
      "revision": "20250db069a849ab001ac6ab9e3e9779886ab9e2",
      "use": "Reusable architecture, workflow, orchestration, and validation implementation reference",
      "implementation_rule": "reuse-permitted-with-provenance"
    },
    {
      "name": "Plane",
      "repository": "https://github.com/makeplane/plane.git",
      "revision": "4fc79a2d7e93e769f2e6251cb4e0436b8ae4d2e7",
      "use": "Reusable product behavior, information architecture, schema, and UI implementation reference",
      "implementation_rule": "reuse-permitted-with-provenance"
    },
    {
      "name": "SveltePlex",
      "repository": "https://github.com/Pandoks/svelteplex.git",
      "revision": "b2469197bc4f45d824f7419ffa4c608ccccff2e6",
      "use": "Reusable Svelte monorepo, application, and shared UI implementation reference",
      "implementation_rule": "reuse-permitted-with-provenance"
    },
    {
      "name": "T3 Code",
      "repository": "https://github.com/pingdotgg/t3code.git",
      "revision": "32c6012dabdbd0eb178b25ea4225d889ec8f6475",
      "use": "Reusable provider, transport, remote-connection, and interaction implementation reference",
      "implementation_rule": "reuse-permitted-with-provenance"
    },
    {
      "name": "Vibe Kanban",
      "repository": "https://github.com/BloopAI/vibe-kanban.git",
      "revision": "4deb7eca8f381f7cbc1f9d15515a9ab8f8009053",
      "use": "Reusable worktree, execution, review, worker, and workflow implementation reference",
      "implementation_rule": "reuse-permitted-with-provenance"
    }
  ],
  "adaptations": [
    {
      "target": "crates/control-plane",
      "sources": [
        {
          "reference": "Vibe Kanban@4deb7eca8f381f7cbc1f9d15515a9ab8f8009053",
          "files": [
            "crates/db/src/lib.rs",
            "crates/db/migrations/20250617183714_init.sql"
          ]
        },
        {
          "reference": "T3 Code@32c6012dabdbd0eb178b25ea4225d889ec8f6475",
          "files": [
            "apps/server/src/persistence/AuthSessions.ts",
            "apps/server/src/persistence/Migrations/031_AuthAuthorizationScopes.ts"
          ]
        }
      ],
      "summary": "Adapted explicit SQLite migration and connection setup plus opaque revocable session storage into the Rust product control plane."
    },
    {
      "target": "crates/server/src/product.rs",
      "sources": [
        {
          "reference": "T3 Code@32c6012dabdbd0eb178b25ea4225d889ec8f6475",
          "files": [
            "apps/server/src/ws.ts",
            "apps/server/src/auth/EnvironmentAuth.ts"
          ]
        },
        {
          "reference": "Vibe Kanban@4deb7eca8f381f7cbc1f9d15515a9ab8f8009053",
          "files": [
            "crates/server/src/middleware/signed_ws.rs",
            "crates/server/src/routes/workspaces/streams.rs"
          ]
        }
      ],
      "summary": "Adapted authenticated WebSocket upgrade, bounded message handling, subscriptions, and replay patterns for the Rust product transport."
    },
    {
      "target": "crates/control-plane worker registry and transport",
      "sources": [
        {
          "reference": "Vibe Kanban@4deb7eca8f381f7cbc1f9d15515a9ab8f8009053",
          "files": [
            "crates/server/src/middleware/signed_ws.rs",
            "crates/server/src/routes/workspaces/streams.rs"
          ]
        },
        {
          "reference": "T3 Code@32c6012dabdbd0eb178b25ea4225d889ec8f6475",
          "files": [
            "apps/server/src/persistence/AuthSessions.ts",
            "apps/server/src/ws.ts"
          ]
        }
      ],
      "summary": "Adapted separate device credentials, authenticated outbound worker communication, leases, ordered outbox acknowledgements, revocation, and fencing into the Rust control plane."
    },
    {
      "target": "apps/desktop/src-tauri",
      "sources": [
        {
          "reference": "Vibe Kanban@4deb7eca8f381f7cbc1f9d15515a9ab8f8009053",
          "files": [
            "crates/tauri-app/Cargo.toml",
            "crates/tauri-app/tauri.conf.json",
            "crates/tauri-app/src/main.rs"
          ]
        },
        {
          "reference": "SveltePlex@b2469197bc4f45d824f7419ffa4c608ccccff2e6",
          "files": [
            "apps/desktop/src-tauri/Cargo.toml",
            "apps/desktop/src-tauri/tauri.conf.json"
          ]
        }
      ],
      "summary": "Adapted the Tauri 2 application shell and in-process backend startup pattern to host the shared static Svelte client and Rust platform in desktop profile."
    },
    {
      "target": "desktop pairing and remote workspace connections",
      "sources": [
        {
          "reference": "T3 Code@32c6012dabdbd0eb178b25ea4225d889ec8f6475",
          "files": [
            "packages/contracts/src/auth.ts",
            "packages/client-runtime/src/connection/onboarding.ts",
            "packages/client-runtime/src/connection/onboarding.test.ts"
          ]
        }
      ],
      "summary": "Adapted the short-lived pairing credential to long-lived client-session exchange and explicit connection onboarding flow to Jet Black SQLite sessions and workspace authorization."
    },
    {
      "target": "Codex provider authentication and structured proposal execution",
      "sources": [
        {
          "reference": "T3 Code@32c6012dabdbd0eb178b25ea4225d889ec8f6475",
          "files": [
            "apps/server/src/provider/Drivers/CodexHomeLayout.ts",
            "apps/server/src/provider/Drivers/CodexHomeLayout.test.ts",
            "packages/effect-codex-app-server/src/client.ts"
          ]
        }
      ],
      "summary": "Adapted the shared Codex authentication home plus isolated runtime state pattern and explicit structured-output contract to Jet Black's supervised read-only CLI provider."
    }
  ]
}
